{
  "$schema": "https://json-schema.org/draft/2020-12/schema",
  "$id": "https://schemas.meshrix.example/schemas/test-suite.schema.json",
  "title": "Test Suite Registry Entry",
  "type": "object",
  "required": ["profiles", "suites"],
  "properties": {
    "version": { "type": "string" },
    "generatedAt": { "type": "string", "format": "date" },
    "profiles": {
      "type": "object",
      "additionalProperties": {
        "type": "object",
        "required": ["description"],
        "properties": {
          "description": { "type": "string" },
          "extends": { "type": "string" },
          "suites": {
            "type": "array",
            "items": { "type": "string" }
          },
          "coverage": { "type": "boolean" },
          "dynamic": { "type": "boolean" },
          "trackedArtifacts": {
            "description": "Exact bounded artifacts refreshed by a complete profile and committed with the accepted version.",
            "type": "array",
            "uniqueItems": true,
            "items": { "type": "string", "minLength": 1 }
          },
          "execution": {
            "type": "object",
            "additionalProperties": false,
            "properties": {
              "mergeVitestProcesses": { "type": "boolean" },
              "cachePassedResults": { "type": "boolean" },
              "shardEnvironment": { "type": "string", "minLength": 1 },
              "phases": {
                "type": "array",
                "minItems": 1,
                "items": {
                  "type": "object",
                  "additionalProperties": false,
                  "required": ["id", "lanes"],
                  "properties": {
                    "id": { "type": "string", "minLength": 1 },
                    "label": { "type": "string", "minLength": 1 },
                    "lanes": {
                      "type": "array",
                      "minItems": 1,
                      "items": {
                        "type": "object",
                        "additionalProperties": false,
                        "required": ["id", "suites"],
                        "properties": {
                          "id": { "type": "string", "minLength": 1 },
                          "label": { "type": "string", "minLength": 1 },
                          "suites": {
                            "type": "array",
                            "minItems": 1,
                            "uniqueItems": true,
                            "items": { "type": "string", "minLength": 1 }
                          },
                          "dependsOn": {
                            "type": "array",
                            "uniqueItems": true,
                            "items": { "type": "string", "minLength": 1 }
                          }
                        }
                      }
                    }
                  }
                }
              }
            }
          }
        }
      }
    },
    "suites": {
      "type": "array",
      "items": {
        "type": "object",
        "required": ["id", "owner", "level", "command", "args"],
        "properties": {
          "id": { "type": "string" },
          "owner": { "type": "string" },
          "command": { "type": "string", "minLength": 1 },
          "args": {
            "type": "array",
            "items": { "type": "string" }
          },
          "package": { "type": "string" },
          "level": {
            "type": "string",
            "enum": ["smoke", "integration", "e2e", "architecture", "security"]
          },
          "sideEffects": {
            "description": "Primary runtime side effect outside the explicitly listed artifacts. Report files and other exact outputs belong in artifacts, not sideEffects.",
            "type": "string",
            "enum": ["none", "build-output", "temp-files", "network-service", "local-agent-state", "container"]
          },
          "requiredServices": {
            "type": "array",
            "items": { "type": "string" }
          },
          "platforms": {
            "description": "Actual Node.js process.platform values supported by this suite's host adapters; omitted means no host OS prerequisite. A container's guest platform does not replace the executing host identity.",
            "type": "array",
            "minItems": 1,
            "uniqueItems": true,
            "items": { "type": "string", "minLength": 1 }
          },
          "flakePolicy": {
            "type": "string",
            "enum": ["fail", "retry", "skip"]
          },
          "profiles": {
            "type": "array",
            "items": { "type": "string" }
          },
          "coverageContribution": { "type": "boolean" },
          "artifacts": {
            "description": "Exact persistent output paths produced by the suite. This is the only source of truth for report artifacts.",
            "type": "array",
            "items": { "type": "string" }
          },
          "artifactSemantics": {
            "type": "object",
            "additionalProperties": { "type": "string" }
          }
        }
      }
    }
  }
}
