{
  "$schema": "./schema/test-suite.schema.json",
  "version": "0.1.0",
  "generatedAt": "2026-07-22",
  "profiles": {
    "gateway-benchmark": {
      "description": "Deterministic real-MCP benchmark harness correctness (not a performance verdict)",
      "suites": [
        "gateway.benchmark-node",
        "gateway.benchmark-correctness",
        "gateway.performance-observation",
        "repo.script-registry"
      ]
    },
    "product-distribution": {
      "description": "Canonical two-product archives, installed dependency boundary and runtime image contents",
      "suites": [
        "repo.product-distribution"
      ]
    },
    "native-linux-client": {
      "description": "Qualify prebuilt Meshrix Entry Linux client archives independently from server and npm release verification",
      "suites": [
        "entry.native-linux-host-build",
        "entry.native-linux-artifact-qualification"
      ]
    },
    "native-macos-client": {
      "description": "Qualify prebuilt Meshrix Entry macOS client archives independently from server and npm release verification",
      "suites": [
        "entry.native-macos-package",
        "entry.native-macos-artifact-qualification"
      ]
    },
    "core-baseline": {
      "description": "Shared repository and foundation baseline",
      "execution": {
        "mergeVitestProcesses": true,
        "cachePassedResults": true,
        "shardEnvironment": "MESHRIX_TEST_SHARD"
      },
      "suites": [
        "runtime.resource-discipline",
        "repo.public-boundary",
        "security.secret-hygiene",
        "security.local-path-boundary",
        "repo.local-info-hygiene",
        "registry.consistency",
        "registry.version-naming",
        "registry.version-governance",
        "repo.root-hygiene",
        "repo.script-registry",
        "repo.organization",
        "architecture.import-graph",
        "architecture.protocol-boundary",
        "foundation.checkpoint-tree",
        "foundation.private-file-atomic",
        "foundation.state-machine",
        "release.acceptance-ledger-anchor",
        "gateway.external"
      ]
    },
    "core-public": {
      "description": "Core verifier gate",
      "trackedArtifacts": [
        "docs/verification/regression.html"
      ],
      "execution": {
        "mergeVitestProcesses": true,
        "cachePassedResults": true,
        "shardEnvironment": "MESHRIX_TEST_SHARD",
        "phases": [
          {
            "id": "environment",
            "label": "Base environment and repository integrity",
            "lanes": [
              {
                "id": "preflight",
                "suites": [
                  "runtime.resource-discipline",
                  "regression.environment",
                  "repo.public-boundary",
                  "security.secret-hygiene",
                  "security.local-path-boundary",
                  "repo.local-info-hygiene",
                  "registry.consistency",
                  "registry.version-naming",
                  "registry.version-governance",
                  "repo.root-hygiene",
                  "repo.script-registry",
                  "repo.organization",
                  "architecture.import-graph"
                ]
              }
            ]
          },
          {
            "id": "functional",
            "label": "Parallel frontend and backend functional verification",
            "lanes": [
              {
                "id": "frontend",
                "suites": [
                  "regression.frontend-build",
                  "regression.frontend-functional"
                ]
              },
              {
                "id": "backend-build",
                "suites": [
                  "regression.backend-build"
                ]
              },
              {
                "id": "backend-server-shard-a",
                "dependsOn": [
                  "backend-build"
                ],
                "suites": [
                  "regression.backend-server-shard-a"
                ]
              },
              {
                "id": "backend-server-shard-b",
                "dependsOn": [
                  "backend-build"
                ],
                "suites": [
                  "regression.backend-server-shard-b"
                ]
              },
              {
                "id": "backend-worker-thread",
                "dependsOn": [
                  "backend-server-shard-a",
                  "backend-server-shard-b"
                ],
                "suites": [
                  "regression.backend-worker-thread"
                ]
              },
              {
                "id": "backend-unit",
                "dependsOn": [
                  "backend-build"
                ],
                "suites": [
                  "regression.backend-unit",
                  "foundation.private-file-atomic"
                ]
              },
              {
                "id": "backend-contract",
                "dependsOn": [
                  "backend-build"
                ],
                "suites": [
                  "regression.backend-contract",
                  "foundation.checkpoint-tree",
                  "foundation.state-machine"
                ]
              }
            ]
          },
          {
            "id": "interface",
            "label": "Frontend and backend interoperability contracts",
            "lanes": [
              {
                "id": "api-contract",
                "suites": [
                  "regression.frontend-backend-interface",
                  "architecture.protocol-boundary"
                ]
              },
              {
                "id": "gateway",
                "suites": [
                  "gateway.external"
                ]
              },
              {
                "id": "evidence",
                "suites": [
                  "release.acceptance-ledger-anchor"
                ]
              }
            ]
          },
          {
            "id": "platform",
            "label": "Parallel platform extension adaptation",
            "lanes": [
              {
                "id": "services",
                "suites": [
                  "regression.platform-services"
                ]
              },
              {
                "id": "plugins",
                "suites": [
                  "regression.platform-runtime-plugins"
                ]
              },
              {
                "id": "agent-adapters",
                "suites": [
                  "regression.platform-client-adapters"
                ]
              }
            ]
          }
        ]
      },
      "extends": "core-baseline",
      "suites": [
        "runtime.resource-discipline",
        "regression.environment",
        "regression.frontend-build",
        "regression.frontend-functional",
        "regression.backend-build",
        "regression.backend-server-shard-a",
        "regression.backend-server-shard-b",
        "regression.backend-worker-thread",
        "regression.backend-unit",
        "regression.backend-contract",
        "regression.frontend-backend-interface",
        "regression.platform-services",
        "regression.platform-runtime-plugins",
        "regression.platform-client-adapters"
      ]
    },
    "security-public": {
      "description": "Security-focused gate",
      "execution": {
        "mergeVitestProcesses": true,
        "cachePassedResults": true,
        "shardEnvironment": "MESHRIX_TEST_SHARD"
      },
      "suites": [
        "runtime.resource-discipline",
        "repo.public-boundary",
        "security.secret-hygiene",
        "repo.local-info-hygiene",
        "foundation.local-secret-store",
        "security.authorization-hardening",
        "security.http-resource-admission",
        "governance.operation-permission-protocol-consistency",
        "authorization.governance-coverage",
        "downstream-mcp.installer-convergence"
      ]
    },
    "audit-public": {
      "description": "Audit gate",
      "execution": {
        "mergeVitestProcesses": true,
        "cachePassedResults": true,
        "shardEnvironment": "MESHRIX_TEST_SHARD"
      },
      "extends": "core-baseline",
      "suites": [
        "governance.tag-management",
        "governance.operation-permission-tag-audit",
        "governance.operation-permission-universal-tag-policy",
        "governance.operation-permission-protocol-consistency",
        "governance.operation-permission-tag-governed-e2e",
        "authorization.governance-coverage",
        "authorization.enforcement",
        "audit.retention-redaction",
        "observability.semantic-baseline",
        "observability.coverage",
        "approval-governance",
        "architecture.facts",
        "governance.organization-model",
        "governance.agent-session",
        "runtime.trace-context",
        "runtime.unified-registration",
        "runtime.operation-proof-substrate",
        "foundation.merkle-state-substrate",
        "runtime.recovery-export-privacy",
        "workspace.proposal-protocol",
        "downstream-client.aspect",
        "security-alert.lifecycle",
        "downstream-mcp.completeness-audit",
        "downstream-mcp.external-http-boundary",
        "downstream-mcp.installer-convergence",
        "downstream-mcp.release-target-scope",
        "downstream-mcp.release-portable-assembly",
        "downstream-mcp.proxy-transport",
        "execution-sandbox.controlled-runtime",
        "execution-sandbox.convergence-final",
        "container.deployment-flow",
        "storage.backup-restore",
        "storage.production-restore-drill",
        "jobs.work-queue",
        "jobs.work-queue-capacity",
        "jobs.work-queue-conformance",
        "jobs.work-queue-process-restart",
        "jobs.upload-workspace-materialization",
        "jobs.upload-custody-workspace-materialization-acceptance",